review,rating,date
"If you found the design of this App annoying and impossible to set up on your phone, you’re not alone.",1,2026-02-21T10:36:46-07:00
"So, you mean to tell me that I bust my butt for my PRs but I have to pay for a subscription in order to see my best efforts. Love the app but ain’t that some money hungry behavior right there.",4,2026-02-20T16:27:22-07:00
Since the newest update Strava will not sync with Wahoo ELEMNT. I can’t upload works outs. Worked fine until 2/18/2026,1,2026-02-19T05:30:16-07:00
"I was randomly logged out and cannot log back in, and have contacted support with no support after signing up for a membership complete fail",1,2026-02-18T08:12:14-07:00
"I can’t submit a help request to support because the dropdown closes in less than 1 second, but can you bring back the back button? If I’m in anything I have to close and reopen the app to take a step backwards",1,2026-02-18T05:41:36-07:00
Me gusta Strava gracias por sus funciones 🙏,5,2026-02-17T22:43:43-07:00
If you’re all about fitness this is the app for you 👍🏼👍🏼👍🏼,5,2026-02-17T17:37:48-07:00
Awesome app. I appreciate those additions. Next addition: rucking 🙏,5,2026-02-17T16:08:08-07:00
Having a hard time reconnecting after apple update,3,2026-02-17T14:59:40-07:00
Be careful. They will attempt to randomly charge you after cancellation of your free trial for a FULL year. Took $80 from my bank account. Currently pursuing legal action.,1,2026-02-17T09:06:51-07:00
Keeps me on target with training and yearly goals. Fun to look back at data,5,2026-02-16T22:05:47-07:00
I downloaded this to see where people were walking in my area and the first route it suggested to me is a notorious homeless camp and very unsafe for a single female to be walking through let alone one with a baby… bummer.,1,2026-02-16T20:22:38-07:00
"I think it would be awesome. If you guys reset individuals efforts each year… While still archiving the top 25 efforts, KOMs, QOMs, and so on… that way, everybody has new goals to strive for each year all the while, still having the awesome services that you guys provide archived for data review.",5,2026-02-16T19:34:40-07:00
It’s insane that you cannot overwrite a stop time. Everyone forgets to end workouts!,1,2026-02-16T16:10:51-07:00
"Strava simply is awesome - tracks all rides , runs activities into one simple place - friends can compete against one another - no other community like it - absolutely love it!!  Especially love it for tracking my OCHL hockey!",5,2026-02-14T16:10:02-07:00
"Still a bit of a clunky mess. Lots of functions that still only function on desktop for some reason, such as exporting GPX routes, which is part of my reason for even getting the subscription at all. Great app if all you want to do is beat random peoples segments I guess.",3,2026-02-14T16:09:27-07:00
Will get 5 stars once the lap button returns!,4,2026-02-14T16:07:15-07:00
"It’s mostly very useful and helpful, but it never gets the distance correct when I run indoors on a treadmill. It consistently lowballs my distance by 0.08-0.10 miles.",4,2026-02-13T16:08:13-07:00
The best free workout tracker and planner I have ever used. Incredibly intuitive and effective!,5,2026-02-13T13:30:24-07:00
"Since the recent update Strava will only sync the very beginning of any outdoor activity to the cloud. Strava seems to record the activity correctly on the Apple Watch Ultra 3, but no longer has the ability to reliably transfer gps data off the watch. Very big bug!",1,2026-02-13T04:49:00-07:00
…is the requirement to have Apple Pay in order to start a free trail. You’ve got to be kidding me. Forget it.,1,2026-02-12T21:59:43-07:00
"Best one I know when comes to sports, endurance and tracking activities! Highly recommend",5,2026-02-12T16:09:55-07:00
What running app doesn’t have a lap feature to track splits,1,2026-02-12T03:14:05-07:00
Found the app installed on my phone with zero knowledge of this app or ever searching for it. Seems about right. 5 stars. Uninstalled though will Install it myself if I ever needed it or will uninstall it again if it ever gets installed by it self again.,5,2026-02-11T22:46:33-07:00
I love Strava! It’s my fav social app. Overall I like the structure and the way I can change my feed to be chronological. My only complaint is that I wish I could flip a switch and hide the map easier activity by activity if I wanted to.,4,2026-02-11T16:23:14-07:00
A good map and tracks your distance and time. I like at groups I’m in cal also see my progress,5,2026-02-11T16:13:42-07:00
By far the best app for endurance workouts no questions asked,5,2026-02-11T16:06:17-07:00
Negative 2 stars. I have not used ap in two months because of an injury. Navigating it for information older than a month is a waste of time. All the adds for membership keep updating so I have seconds to find information before an add opens or the page sends me back to the beginning. You feel compelled to pay a subscription just to access your previously recorded activities and make them go away. Not worth the time.,1,2026-02-11T06:08:58-07:00
It is good to use,5,2026-02-10T16:05:47-07:00
"They won’t give me the discount for working at a medical institution because my institution isn’t included, despite sister schools in my system being included.",1,2026-02-10T11:53:15-07:00
"Very busy UI,  iOS app doesn't automatically start the Apple Watch app,  only pulls in heart rate if you start the activity on the watch...and then the iOS app isn't active so it's basically useless during an activity.  seems it's two independent apps.  Can't change what displays on the Apple Watch app...who measures a walk in MPH?  
Doesn't integrate with other platforms that have better UI's
During an activity like MapMyFitness",2,2026-02-10T07:49:03-07:00
"There are some bugs with the app, specifically while running sometimes the ‘lap’ button disappears so then you can’t run and time your splits",1,2026-02-10T05:26:08-07:00
"I finished a walk and Strava fritzed when I tried to save the walk. Next day when I started my walk Beacon was gone, and Strava changed.",1,2026-02-09T07:52:43-07:00
Strava has put so many of its basic metrics and functionality behind a paywall it’s hardly worth using anymore.,3,2026-02-08T16:07:44-07:00
Always plays a role in getting more motivated on each ride,5,2026-02-08T16:05:45-07:00
"Overall great app, have been using it since 2018, started with cycling, but since have gotten more into hiking. It tracks hikes, but you can't get the summary of all your hikes in the statistics tab. This would be a really nice feature to add for hikers.",4,2026-02-08T08:36:50-07:00
This app is not very intuitive on top of every single function you try to use being behind a paywall. Then the app freezes when the pop up appears and I have to restart the app every time. Not sure how you would build a strong user base this way.,3,2026-02-07T08:29:10-07:00
I used Strava religiously a couple years ago. I ended up switching over to apples fitness tracker the a couple years and thought I’d return to Strava to see what has changed. I’ve found they just want to push their subscription. I use to enjoy being able to look at my past runs to see my progress. One of my favorite features was being able to see my best efforts and being able to compete against myself. The best effort feature is now behind a paywall.,2,2026-02-06T17:57:08-07:00
Absolutely worth the subscription fee. Love the route planning.,5,2026-02-05T16:15:28-07:00
Please make it free or cost a bit less and I will buy,5,2026-02-05T16:15:02-07:00
I like the simplicity of how Strava records my hikes & activities.,4,2026-02-05T16:12:21-07:00
"I used to love this app. Had a lot of fun tracking my activities using Heatmap and friends I follow used to like the aesthetic of the map on my activity feed. Out of nowhere the images started getting warped/blacked out. Looked like I was looking through a kaleidoscope. My activity feed became sloppy-looking. The communication around this went on for over a month with tech support team - they didn’t listen to what I was saying and simply provided fixes to other issues that I wasn’t describing. They were clearly trying to close open tickets quickly without actually resolving my concerns. Essentially, over time, this product has gotten worse and worse for how I initially liked using it. Features I liked are no longer functioning properly and support has not been helpful nor timely with communication. I’m actively looking for an alternative option.",2,2026-02-05T08:08:52-07:00
I enjoy using the app itself but don’t appreciate the difficulty of canceling the free trial or subscription.  They make it easy to sign up “in the app” but actually signs you up through web browser in app.  Then to cancel you have to do it through the website but the website takes you to the app every time you log in.,2,2026-02-05T03:50:45-07:00
"Being able to see my friends activities and running is really cool but the tracking is pretty inaccurate both in time and distance. Especially when you are running around a track, which you don’t really need Strava for, but it’s frustrating that it says I ran a 5:38 mile, but I know I’m maybe running an 8 minute mile and I can’t beat my best time because it tracked me wrong",2,2026-02-04T22:14:36-07:00
"The Strava is user friendly.  It’s easy to switch between activities.  It’s good to see when I reach goals that I set for myself.  I bike over 12,000 miles per year",5,2026-02-04T16:10:27-07:00
I’ve just started to run distance and this app has encouraged me to do it more often and farther,5,2026-02-04T16:07:43-07:00
"Because the play/pause menu and ride/walk stats are not able to be minimized, I'm no longer able to just explore the map in full screen. That's how I've planned all my rides and hikes for years. Doing it on half the screen is really annoying.

It's gotten even more frustrating with time. In the past, I could count on having the map visible while I rode, and I could pinch and turn it to plan ahead. But now because only half the screen is permitted for the map, my inputs aren't read nearly as sharply, and half the time I want to zoom, it rotates. Now I'm spending more time looking at the phone while I'm riding, which means right then this app is specifically making my ride more dangerous than it used to.

Still a really good app, but please get that out of my way when I'm not using it. Then it's back to 5 stars.",2,2026-02-04T14:15:31-07:00
"A must download. UI is great and connecting with friends through the feed is great for staying healthy, accountable, and in-touch!",5,2026-02-01T16:17:08-07:00
Great app.  You should use it in your life,5,2026-02-01T16:05:00-07:00
"Please, just stop offering to sign EVERY TWO SECONS!!!!!!! EVERY TIME!!!! STOPP!!!",1,2026-01-31T09:21:34-07:00
Just started working out and this app has been a great way to track all of my different workouts,5,2026-01-31T04:46:32-07:00
The subscription popups can go get bent.,2,2026-01-30T21:22:38-07:00
Great app. Helps you track your time/progress and track your route. Really helped me get back into shape and made it fun with data and maps. Love going to a new city while traveling for work and mapping out a run. Highly recommend to invite some friends as well.,5,2026-01-30T19:00:55-07:00
"Strava used to show your run’s overall average pace during runs. I updated the app and it now shows your current mile’s pace only, with no option to revert back to the “overall pace” view. I can’t think of a single less helpful update they could have made.",1,2026-01-29T21:56:41-07:00
"The app won’t let me add my Apple Watch. I have a pretty new Apple Watch (series 8) and when I try to connect my Apple Watch to the app, it freezes every single time. This must be a bug with the app and is super frustrating. I was excited for this app to use my watch exercise stats. Strava please fix this.",2,2026-01-29T18:04:12-07:00
Strava is a great platform for tracking workouts (auto-sync from Apple workouts or record within the app) and monitoring progress on training goals. The paid version offers great tools to monitor performance and predict race results. However the best part of the app is the ability to feel like you’re part of a community encouraging each other day by day.,5,2026-01-29T16:13:32-07:00
Social aspect is good. Setup with Apple Watch is frustrating and clunky but works. Route planning is awful.,3,2026-01-29T06:47:22-07:00
The apps not working,4,2026-01-28T16:27:58-07:00
"Unable to add rides or record sessions, “something went wrong” error repeatedly",1,2026-01-28T16:23:23-07:00
Very slow. Sometimes it does not download workout from Apple Watch automatically.,1,2026-01-28T16:20:48-07:00
I’ve been using Strava for probably a decade. I love being a subscriber & get all the features to keep me improving & training. I enjoy all the challenges every month & the end of year stats along with a free water bottle with your stats on there.,5,2026-01-28T16:16:46-07:00
Me encanta,5,2026-01-28T16:13:48-07:00
There is no indoor row workout. There is stair step and elliptical but no row machine feature.,1,2026-01-28T05:15:48-07:00
Best cycling app ever!,4,2026-01-27T16:06:05-07:00
Great app does all that I want. Sorry for $80 a year it is way overpriced. I’ll use the free version even though they have stripped it of every feature over the years. Every time you update another feature is paywalled.,2,2026-01-26T20:55:44-07:00
"It, like everything else from the 2010s just kind of sucks now. Now particularly offended that they paywalled some of the best features, but am at over the top  obnoxiousness of the constant ads and placeholders for “premium” everywhere. Like, as in, might be time to move off to another GPS enabled fitness app. Dont need my “friends” on here anyway.",3,2026-01-26T14:48:04-07:00
Used to have good features but are now behind a paywall. If you don’t use it I advise to not start.,1,2026-01-25T18:49:47-07:00
Strava has been very helpful with my pacing. Which I need.,5,2026-01-25T16:10:21-07:00
"I’ve been a premium member of Strava for about 13 years. I love that they’re always improving the platform finding new stats statistics to track love diving into the data. Everything is there that I need. I really appreciate the guys that create the program love this platform. don’t use anything else, but Strava.",5,2026-01-24T16:13:19-07:00
"I’ve been away from Strava and I’m just now coming back to it. I don’t want to pay or sign up for a free trial yet, but literally almost everything you click in the app forces you to either sign up for the trial or join the paid version. Every useful feature is behind a paywall. 

So if you’re looking for something good and free, look elsewhere. The user designed for anybody who doesn’t want to commit to signing up for anything is dreadful. There should be an option to remove all pro futures so you don’t consistently get an annoying pop-up every time you accidentally clicked something that is a “pro feature”.",2,2026-01-24T08:13:40-07:00
"Why are you making me unclick each individual email setting? I want to unsubscribe from all, especially if I’m paying you >$100/year and very active. Weird.",2,2026-01-24T07:44:24-07:00
Great app to track all activity and share with friends.,5,2026-01-22T16:15:22-07:00
Even if you turn off marketing notifications they’ll still send you them. Moreover the app will reset notification preferences periodically.,1,2026-01-22T11:32:09-07:00
"I went to send a kudos to a person I follow, then my app glitched out and wouldn’t load any pages. I logged out and tried to log back in but got “something went wrong” error. I’ve tried logging in on my PC using chrome and also on my phone using safari and still getting it.",1,2026-01-22T01:55:33-07:00
Every time I try to save the transparent photo nothing happens.,2,2026-01-21T21:40:54-07:00
mwah🤌🏼,5,2026-01-21T18:26:45-07:00
Obsessed,5,2026-01-21T16:19:28-07:00
If you didn’t Strava it it didn’t happen,5,2026-01-21T16:18:29-07:00
Strava is a great app. It’s super cool to be able to keep up with everyone you know on your journey to staying fit.,5,2026-01-21T16:12:06-07:00
"All of the excellent things you need and want in an activity tracking app. Great stats and data, accurate tracking, easy to use. 

Why I put 3 stars: there are unnecessary issues with the app, notifications, and support. 
- no matter how may times you check that you don’t want notifications, you’re still inundated with them
- email notifications specifically, based on their help page, have been an issue for years and is still unresolved. if my settings have email notifications switched off, why am I still getting daily kudos and comment notifications in my email? 
- if you want to submit a support ticket, that landing page isn’t formatted for mobile (for a huge company, not checking your user experience on mobile is wild). the drop down doesn’t work to even start a help ticket on mobile, so you’ll never be able to submit one, which feels like an intentional “oversight” for a company running a internationally used app. 
- I understand that you can’t opt out of certain marketing and security emails, that’s not the problem. it’s the unnecessary emails that you can “opt out” of (you can’t, that option is fake). don’t provide that setting option if it’s not real — so then I can decide to delete my account and stop using the app. if the setting is there, make it actually work.",3,2026-01-21T14:28:42-07:00
I bought the duo subscription and Strava is not letting me access any of the features. Ive put in multiple complaints to support but they are being closed without resolution. At this point I would rather take the refund.,1,2026-01-21T07:47:33-07:00
Horrible experience trying to connect my garmin device. Had to delete the app,1,2026-01-20T20:05:08-07:00
Great app,5,2026-01-20T17:48:43-07:00
"I truly believe big companies that have 1000 employees or more should pay for this app. This will help keep all employees healthy, happy and more productive.  👍🏽",5,2026-01-19T16:21:54-07:00
"Strava is the #1 social fitness app.  Easy to record workouts, easy to find motivation, easy to encourage others.     Works for athletes or all skill levels.",5,2026-01-17T16:14:03-07:00
Love the app,5,2026-01-17T16:06:12-07:00
Is there a way to add the minutes walked to distance total walked somewhere in the rewards section on the challenges tab? This would be really appreciated to see this visually and not have to guess click on the title reward  button to earn our challenge reward.,5,2026-01-17T12:09:54-07:00
Just odd. Also it’s way too hard if not impossible to see historical monthly totals,2,2026-01-17T10:20:08-07:00
"I signed up for the free trial, and paid for the annual. And none of the paid features work. It just keeps asking me to sign up. Really disappointed in this given its aggressive SEO and marketing campaign.",2,2026-01-17T04:58:43-07:00
"Here we are in 2026 and the Strava watch app is worse than ever! That’s right, you’ll be blocked from recording an activity occasionally, and more than likely, the app the app will crash out in the middle of your activity. But hey, there’s so much MORE to Strava with premium subscription. Come on guys, you can do better.",1,2026-01-16T16:22:49-07:00
Amazing app for working out,5,2026-01-16T16:13:42-07:00
It’s great!,5,2026-01-16T15:50:16-07:00
This is the perfect app for all your sporting needs it’s awesome,5,2026-01-15T16:12:35-07:00
"The bugs and glitches got to the point I quit paying for my subscription. Dropped signals, segment errors, upside down readouts etc and lack of customer service.",1,2026-01-15T16:09:20-07:00
Best app ever.,5,2026-01-15T16:04:06-07:00
"It’s sad but these days strava no longer has a premium experience. It has become worse with every update to the point that it is not fun to use without a subscription. 

Strava feels cheap. Always asking for funds always trying to push products I do not want. 

Click anywhere on seventy percent of any screen and you get a pop up asking to start a subscription. The user experience is totally disrupted.

The current miserable state of the app is just Sad.",1,2026-01-14T22:57:23-07:00
I love this app!!,5,2026-01-14T17:18:07-07:00
I love using strava for my easy runs and my workouts.,5,2026-01-13T16:47:29-07:00
I love ts,5,2026-01-13T16:13:37-07:00
"I wish this app was more inclusive to roller skating rather than forcing us to choose rollerblading in the clubs area. On top of that when I try to look for paved locations to skate on I have to choose “bike” for the filter because it refuses to scroll down past that. I don’t know if this app just doesn’t provide more or if it’s glitching and refuses to move from there. Overall, not very impressed and kinda let down.",2,2026-01-13T11:01:21-07:00
"Absolutely garbage cash-grab decision for 2025-26 to charge $12 Subscriptions just to view an annual recap. Use Runna, Stridekick, or Runkeeper as much better alternatives",1,2026-01-12T20:39:06-07:00
once you add volleyball as an sports option!!!,4,2026-01-12T20:34:53-07:00
awesome app,5,2026-01-12T16:17:40-07:00
"I downloaded Strava to “go on more walks.” What I got instead was a deeply intimate performance art platform that eroticizes productivity, surveillance, and self documentation in a way no dating app ever could.

There is nothing sexier than a glowing orange map of where I’ve been. Look at me. Witness me. I walked 4 miles and felt something. The pace? Slow. The elevation gain? Emotional. The time of day? Questionable. The commentary? Vulnerable enough to be inappropriate, but framed as “wellness.”

Strava knows when I’m active. It knows when I’m resting. It knows when I’m spiraling but calls it “recovery.” It rewards me with digital badges for consistency, which is frankly a kink. Every post feels like whispering into a public diary while pretending it’s just cardio.

Other apps ask, “What are you looking for Strava asks, “How did it feel?” And I answer. Every time.",5,2026-01-12T16:10:20-07:00
My fave social media platform,5,2026-01-12T16:09:33-07:00
Y’all make it impossible to cancel a subscription. I don’t want a subscription this app is useless what would anyone pay for something my Apple Watch does for free?  Costumer service is nearly impossible to find this scam need to be audit like they did Amazon,1,2026-01-11T08:51:12-07:00
"I have been using strava for five plus years. I use it to track my cycling for the most part and my overall fitness. So RE and fitness scores have become key. I’m in my mid fifties and while I’ve noticed strava has a natural age bias imo in that it doesn’t account for HR naturally declining as you age, recently it has just gone bonkers. I do a lot of repeat rides and all my recent rides have like half the RE scores despite the power and HR and speeds being similar or even better. This makes the fitness metric useless and quite frankly demoralizing which is kinda opposite what you want. Happy to share details with developer. 

For those of us embedded in strava. We can only hope they don’t grow too big and forget what they are about. 

For new users, it’s not what it once was.",2,2026-01-10T23:03:51-07:00
AI based support not helpful,1,2026-01-10T18:31:55-07:00
Enjoying tracking my workouts/training along with my friends - only request - bigger fonts!,4,2026-01-10T16:06:17-07:00
"All my friends use it so we can encourage each other to to try to get faster. This app is great, you should get it!",5,2026-01-10T15:09:02-07:00
Good but needs a dirtbike option,5,2026-01-09T13:01:54-07:00
Horrible,5,2026-01-08T17:51:54-07:00
Version 441 allowed you to use hyperlinks in posts and comments. Verizon 442 broke the feature again. Hyperlinks no longer display in the app. Please fix.,1,2026-01-08T09:15:25-07:00
Easy to use. Encourages you to be active.,5,2026-01-07T16:13:41-07:00
"The ads take up a lot of real estate in the app. They don’t go away when you have a paid subscription. 
Kudos bot cannot be disabled. 

Otherwise it is a great, device independent, exercise platform.",3,2026-01-07T14:07:53-07:00
Great for tracking workouts and progress and health. Compete with friends!,5,2026-01-07T08:41:54-07:00
"Before you skip this app, read what I have written and decide afterwards, trust me. So I’m in my high school cross country and track and in the past I have been off and on being lazy and going all in. After I got the app I feel I have been more consistent in my training because the app in my opinion challenges you to go harder and farther as the week’s progress. I used to only do like 1-6 mile runs or workouts but while using the app I have finally gotten to 10 miles running and 31.07 (50K) on a stationary bike. For any runner considering this app and want to start running, biking, or swimming, I seriously consider getting this app. You don’t need to be in the best condition and it doesn’t matter your age or gender. All people are welcome to join this app. It’s never to late to start but the sooner you do the better you’ll feel :D",5,2026-01-06T16:24:42-07:00
I enjoy every one with Strava,5,2026-01-06T16:18:14-07:00
"Great app for tracking but they REALLY want you to get premium. It works great without it, not a money grab app, but lots of pop ups to convince you to get premium.",4,2026-01-06T16:11:36-07:00
